system_id,sentence
279,像是江湖對話老大弄小弟橋段跟酒瓶砸頭連擊
279,還有香港電影都喜歡把女角綁床頭看到這段就會想到邱若男我要
279,香港仔武器還是扁鑽勒好久沒看到這東西死前還記得說給我個理由，這些都很有港片影子
279,第三段尊者宗教篇，本以為只是帶入台灣怪力亂神的師父騙術，沒想到後面變成昆丁上身
279,釘棺材後從土裡爬出挖出武器開始大殺特殺，這段只差沒用上追殺比爾配樂
279,雖然觀眾在上帝視角從頭開始就會感到不對勁，但又像是讓主角能找到了平靜救贖，因為小胖事件的轉折又整個大反轉，最後符合觀眾期待把那些無可救藥之人都殺光雖然槍槍暴頭很扯
279,演尊者的陳以文台詞有夠多，講的每句都是道理，關鍵時刻時軟時硬，把師父蠱惑人心的話術講的有夠傳神，就算死到臨頭還是要繼續堅持理念，難怪會讓喪志失意者當作依靠跟救贖
279,看到最後沒想到會演到他生結束，當看到小美刮鬍子時才知道她的人設是要幫他洗心革面，縫補了外套上的洞口跟理容都是呼應這句成語吧，至於誰是周處可能是小天又或是藥師，就大家各自解讀
279,這部真的不錯看有文有武有劇情，還有安順哥來客串以後會不會變成小天宇宙的固定彩蛋
279,裡面最衰的應該是李李仁演的陳灰，像是開頭就被弄瞎眼，中段跳下扭到腳，要在河裡扭打，最後還要幫弄瞎他眼的犯人救贖，這警察真的是活菩薩
280,先無雷結論
280,覺得是部中上之作但缺點也很明顯
280,不排斥國片平常有在看國片的可以看
280,裡面的動作跟鏡頭都蠻有水準的
280,但直認為國片最大的問題還是流暢度跟劇情
280,以下解釋
280,~~~~~~~~~~~~~
280,~~~~~~~~~~~~~~~~~~~雷文主文分隔線~~~~~~~~~~~~~~~~~~~~~~~~~~~~~~~~~
280,主軸蠻明確的片也很好懂
280,主角塑造的也很立體很有情緒
280,對，大概只有主角而已，其他角色怎麼說呢我感受不到他們的情緒
280,整部片還算流暢，但覺得很多國片直有如上所述的問題
280,就是劇情常常會破洞，節奏忽快忽慢的感覺
280,像是邪教殺人只捅刀還不是要害釘釘就埋起來
280,然後阮也跟超級賽亞人樣血條無限隨便撞幾下就出來了
280,也許很多人會覺得這是瑕不掩瑜的地方不要計較這麼多
280,但這種好人如何逃脫對我來說是關鍵的轉折
280,是劇情推進很重要的部分我沒辦法忽略
280,應該說感覺是編劇不知道要怎麼讓阮回去報仇就隨便弄個不合理的主角威能
280,然後搪塞過去覺得觀眾會買單
280,這對我來說相當無法接受偏偏很多國片都有這種感覺
280,西片當然也有，但國片比例偏多
280,是讓我覺得很可惜的地方應該可以編得更完整更合理些
280,然後小美跟陳灰的角色情緒堆疊也是超級薄弱
280,不知道是不是篇幅太短了
280,總感覺有種
280,哇你們什麼時候感情這麼好了
280,完全看不出來也很出戲
280,然後診所老闆講話口條也超讓我出戲的
280,講講好的部分
280,覺得阮經天演得相當好
280,金馬男主如果是他我個人完全贊成
280,真的會讓人有種跟著他情緒起伏的感覺
280,特別喜歡綁鞋帶和在門口食物這些謹慎的小動作蠻細心的
280,動作戲很讚拳拳到肉相當有真實感
280,整體劇情的精采張力以及娛樂程度蠻高的
280,尤其是後面邪教那段
280,雖然有點拖但蠻有諷刺的創意
280,手槍會卡彈就算卡彈也要留下來等等這邊的劇情很不錯很有新意
280,原來是你知道會卡彈阿難怪追港仔的時候最後才拿出來
280,個個殺讓觀眾好好沉浸在這種詭譎的氛圍裏面
280,思考享受以及觀察畫面我覺得還蠻用心的
280,然後太常看陳以文演這種偽君子了
280,所以看到他就覺得哩麥毫小，你就是林祿和吧
280,反轉的部分普普，我個人是覺得很好猜啦，
280,尤其那個光片被撕破鄭有傑還特別講句很不合邏輯的話
280,超令人懷疑
280,另外就是香港仔演的超好
280,真的令人不寒而慄
280,在髮廊和阮對戲的那段也相當有張力
280,王淨跟李李仁就不說了
280,基本上他們換其他人演我也沒什麼感覺
280,因為劇情上有夠薄弱
280,這部分缺點也蠻嚴重的
280,大概這樣不差的娛樂型國片啦
280,但我是不會對他人說很好看，只會說還不錯可以當娛樂去看的程度而已
281,雷文防雷資訊頁
281,~~~~~~~~~~~~~
281,~~~~~~~~~~~~~~~~~~~雷文主文分隔線~~~~~~~~~~~~~~~~~~~~~~~~~~~~~~~~~
281,先說負雷
281,阿季有出現的地方都讓我覺得很難看，口條聲線表情都不及格
281,很少看到年長演員還演技那麼差的
281,之前華燈裡面就覺得大家演技都好尷尬，然後
281,她
281,是演的最差的，裡面我覺得言言演的最好
281,王淨這角色感覺應該可以找其他人來演，不夠柔弱也不夠性感，也不蘿莉，不知道是什
281,麼路線
281,短瀏海造型俏皮有加，但不太配這角色
281,總之就是覺得沒有性的吸引力
281,個人淺見啦，些張力強度比較重的戲也感覺不到火花，
281,但也有可能這幾年新生代女生只有她能演了
281,優點
281,可以說是台灣歷年來最好看的黑道跟武打電影，劇本設計非常可以
281,動作設計很流暢，李李仁跟阮經天的打戲讓人真的覺得勢均力敵非常刺激
281,阮經天跟袁富華第幕對手戲也很精彩
281,阮經天/袁富華/陳以文三個人完全不讓人失望
281,袁富華的演技很完整的修復了阿季前面出場帶來的傷害，看她我真的好痛苦，直到袁富華
281,出現我精神都來了
281,最後的殺戮真的非常出乎我意料之外，夠狂耶
281,謝謝香港導演黃精甫讓台灣電影能有不樣的路線和發展，
281,我自己總是在用鼓勵的心態在看國片，
281,但這次真的覺得平心而論這是部好電影，謝謝導演也謝謝各演員們給我們看到部好作
281,品
282,有雷討論
282,片尾最後小美幫桂林刮鬍子那段有點多餘又冗長
282,但如果劇情這樣拍會不會變神劇
282,小美其實是牛頭生的女兒
282,二十年前香港仔把小美跟小美媽媽從牛頭手上救出來
282,小美從小只知道香港仔是救命恩人
282,但心裡直記著生父牛頭對她唱的歌新造的人
282,桂林仔連續殺了小美的繼父香港仔
282,還有生父牛頭
282,執行死刑前小美為了感謝她
282,把兒時記憶新造的人唱給桂林聽
282,全劇終
283,如題
283,周處除三害劇情算單純
283,個人推薦演員部分
283,尤其是片中三名主角
283,以下有雷
283,~~~~~~~~~~~~~~~~~~~雷文主文分隔線~~~~~~~~~~~~~~~~~~~~~~~~~~~~~~~~~
283,覺得這部可惜的部分是只有阮經天代表的癡豬描寫比較多
283,而過多的戲分給了意義不明的陳灰和小美
283,也間接分散了另外兩名主角袁富華代表的嗔蛇及陳以文代表的貪鴿
283,個人認為要嘛就好好塑造陳灰與三個槍擊要犯的追捕關係
283,要嘛就好好讓王淨飾演的小美與陳桂林連結深點
283,兩個都佔戲份但又沒有帶出夠深的連結實在是讓人對最後段感到莫名與不耐
283,袁富華和陳以文都是很厲害的演員
283,香港仔的喜怒無常令人不寒而慄的感覺
283,牛頭那講幹話的本領以及善惡瞬間的切換其實都演得很好
283,但最終為何只有阮經天入圍男主角而袁富華/陳以文沒有
283,關鍵就在於戲份可發揮的太少這部既然英文片名叫豬/蛇/鴿
283,若能聚焦於三人間的對決或如圖暗示的互咬關係應該會更精采
283,尤其小弟很想看狠辣的香港仔袁富華與陰險的牛頭陳以文的對手戲
283,再加上執迷於名聲的陳桂林應該可以寫出更有趣的故事
283,很可惜袁富華與陳以文沒有對手戲
283,導致末段的劇情很莫名相信也是這部沒能入圍劇情片的原因
283,只能說好看但有點小可惜
283,畢竟資深老戲骨間的交鋒絕對能讓故事增色不少
284,完全無雷，純心得
284,剛跟妹子去看，妹子覺得不錯
284,蒼鷺與少年妹子不推薦
284,看名子就知道是老梗片，但節奏緊湊，
284,算是近年國片前幾名的動作片了
284,比較大的缺點就是謝瓊煖的口條聲線不行
284,可說是部沒有浪費電影票錢的國片
284,小廳可以/也不挑音效的片
285,/////
285,麋先生獻聲電影阮經天想當團員
285,//
285,//////////
285,麋先生包場電影周處除三害，男主角阮經天左四和王淨右四驚喜現身
285,相信音樂提供
285,記者陳慧玲台北報導曾獲金曲獎最佳樂團的麋先生，為阮經天王淨主演電影
285,周處除三害量身打造片尾曲壞蛋，麋先生也在中化身最狂壞蛋使壞演出
285,//////////
285,麋先生聖皓拍，在火光前演唱
285,相信音樂提供
285,阮經天在周處除三害演技出色，他也入圍本屆金馬獎最佳男主角獎，不少觀眾都覺得
285,他奪獎呼聲高
285,前幾天麋先生包場電影力挺，阮經天王淨和監製李烈都驚喜現身，阮經
285,天笑說平常很少跟群和自己身高差不多的男生們站在起，讓我自己感覺很像麋先
285,生的員
285,配合電影，麋先生在壞蛋中也無所不用其極的壞，打造度翻車場面，團員
285,還在煙霧瀰漫的火堆中登場演出
285,阮經天在電影中展現癲狂著魔的執著，問麋先生私下會為什麼事堅持到底
285,團員說我
285,們最執著的事情就是做音樂，從國高中認識組團到現在，遇到很多阻力，但我們仍然還在
286,如果密醫和小美要換角的話大家覺得有什麼人選呢
286,密醫我覺得琇琴應該不錯，年齡也適合
286,小美的話我心裡完全沒有人選，我自己是覺得要更柔弱點，王淨造型和氣質就是青春俏
286,麗，沒有那種可憐兮兮或純慾的感覺
286,如果可以幻想下，年輕時的廣末涼子來演好像會很不錯
286,歡迎大家提出討論
286,後
286,什
286,華
286,作
287,雷文防雷資訊頁
287,~~~~~~~~~~~~~
287,~~~~~~~~~~~~~~~~~~~雷文主文分隔線~~~~~~~~~~~~~~~~~~~~~~~~~~~~~~~~~
287,影片影評
287,///
287,我必須要承認，雖然我喜歡看電影，不過身為台灣人，我卻不是經常會第優先看台灣電
287,影的觀眾
287,因為我是個被日本動畫日劇與好萊塢電影養大的孩子，對我來說，我很習慣明快的故
287,事內容，以及激烈又可以快速打動觀眾的劇情轉折，雖然說我也喜歡看悲情城市
287,少年咧安啦甚至我也非常熱愛胡金銓的龍門客棧與俠女如果你們沒看過，
287,我絕對推薦要去弄來看看
287,但是我的觀影習慣就真的不在台灣電影，主要原因，是台灣電影總是給我種溫良恭儉
287,讓的氣息，也許是因為台灣電影業界總是講究不得罪人與人為善的文人氣使
287,然吧，所以故事再怎麼講，總是給我種這個主角到底想幹嘛
287,的疑惑，而也許就像
287,台灣人從來搞不清楚自己的身份定位的歷史共業下，總是會有隨波逐流保持現狀
287,的生活習慣，這樣的居民，自然就會寫出那種我不知道以後該怎麼辦，但是我要描繪
287,我現在的感覺的故事
287,雖然也不是說這種電影不好看，但老實說看多了就真的會很不耐煩，我不喜歡老是在電影
287,當中看到優柔寡斷的角色啊
287,所以我要是有特別想要寫文聊台灣電影，多半都是這部電影特別不樣，九把刀的月老
287,報告老師
287,怪怪怪怪物
287,程偉豪的緝魂，都是如此下的產物，要很能觸動我
287,的感性，我才會真的想要寫些什麼來聊聊我的感覺
287,///
287,///_
287,而這次我選擇了周處除三害
287,對我來說，周處除三害實在太有趣了
287,這部電影可說是真正台灣意義上的黃昏三鏢
287,客，終於又看到部台灣電影突破溫良恭儉讓的小確幸，拍出部轟轟烈烈的犯罪電影
287,了
287,雖說犯罪題材的電影在台灣行之有年，但是年之後的台片的犯罪電影，總是很難真的
287,做出像好萊塢的我倆沒有明天閃靈殺手或是香港的省港旗兵那樣，去探討
287,個罪犯的心路歷程與行事動機的作品，我也不知道為什麼會那樣，也許是台灣電影大部
287,分的創作者不太敢去探究自己內心的陰暗面嗎
287,總而言之，做出來的東西就總是感覺得出
287,來是有所保留的
287,但是周處除三害就是不樣，也許是因為導演兼編劇黃精甫的香港血脈的關係，這部
287,電影的故事架構簡單而清楚，角色的行為動機也非常明確單純，主角陳桂林不是什麼英雄
287,人物，他擁有道地台灣的幫派年輕世代的價值觀他不講義氣，也不講意義，他追求的就
287,只是希望有人能知道他這個人，簡而言之，就是想出名，為了這件事，他可以不擇手段的
287,殺掉任何人，甚至讓自己頭破血流身受重傷也無所謂
287,但是他仍舊也是個凡人，所以畢竟有自己關心的人與朋友，也有軟弱的時刻，所以當唯
287,的親人祖母過世，又被告知自己得了絕症將不久人世時，陳桂林忽然間也有了人之將死其
287,言也善的想法了，但是以他這種心思單純的人，是不會有什麼複雜的想法的，本來他的人
287,生目標就是想要成名而已，而當發現自己沒有想像中那麼被警方關注之後，他更是決定要
287,為名除害
287,於是周處除三害的故事線目標相當清楚，這是個人打算要去殺掉兩個人的故事，而
287,"且電影的英文片名,,，開始就已經在明示這部"
287,"電影想要拍部台灣版本的黃昏三鏢客英文片名,"
287,，故事就此描繪了主角陳桂林的獵殺旅程，陳桂林自己是豬，並且遇到了兩個
287,對手蛇與鴿子
287,這是故事的架構，但是如果只是劇情單純明快，那也沒什麼了不起，周處除三害了不
287,起的地方，就在於它本體雖是劇情片，但是在各種環節都沒有草率行事，警察追捕陳桂林
287,，就真的有緊湊的警匪追逐路追打，還讓觀眾鏡到底看到阮經天與李李仁從天井摔下
287,樓層，而且彼此扭打的過程也頗具邏輯推演，觀眾看得清楚兩個人打鬥的過程與勝負，
287,喔這點真的是很不容易啊，過去的台灣電影每次拍到打架都馬是糊隆過去，最常看到的
287,就是攝影師自己很緊張的把鏡頭晃來晃去，可是觀眾永遠都無法搞清楚狀況
287,///
287,周處除三害的打鬥邏輯相當清晰，所以我才有辦法做這個二創影片
287,然後接下來陳桂林決定獵殺目標之後，從台北下台中去找代表蛇的香港仔時，敘事方
287,法轉而成為了跟監盯梢的懸疑故事，飾演香港仔的袁富華演出了個喜怒無常又對王淨
287,展現性暴力的危險人物，雖說看過無間道裡頭曾志偉那個頭雖小，但是卻氣勢驚人的
287,表現之後，再看袁富華的表演就覺得氣勢有差，但是這場戲搭配了王淨楚楚可憐的表情以
287,及被性虐待的故事描繪，觀眾絕對都在期望主角出來主持正義
287,而豬與蛇的對決氣氛
287,與開場的警匪追逐戲又截然不同，瀰漫著野蠻與殘暴之氣，打完之後，香港仔問陳桂林
287,為什麼要殺我
287,的時候，阮經天露出絲笑容時，堪稱是這場戲最有趣的時刻
287,接下來，阮經天與王淨搭車揚長而去，此時搭配出現的音樂完全是賽吉奧里昂尼式的西部
287,片風格，那刻，台中夜晚的街頭彷彿成了狂殺十萬里般的無法地帶，兩人接著在海
287,邊，挖土機群排出來的幾何構圖畫面下談話時，這個刻意去搭乘的景點也把台灣塑造成了
287,個充滿妄為渾人的江湖，那刻，電影竟然還浮現了股現代武俠般的浪漫
287,而對我而言，周處除三害最堪玩味的戲，卻是接下來豬與鴿的相遇，不同於
287,蛇那種外顯的暴力與佔有慾，豬遇到了鴿子面對的是場心靈的戰爭，陳桂
287,林好勇鬥狠，不怕打不怕摔，但是精神面卻極其脆弱，親人去世無法奉養，他內心有愧，
287,身患絕症的陰影，也讓他反思自己人生的意義是什麼，此時由陳以文飾演的上師登場，
287,讓全片的氣氛為之變，周處除三害忽然又成為了心靈哲學電影，無論是氛圍與氣場
287,都從前半截的肅殺轉為寧靜祥和
287,然而這部電影若是這樣結束，就辜負了發行方所謂最兇最惡的宣傳了，在祥和當中隱
287,藏的絲詭異與不安，隨著劇情漸漸擴大，直到最後成為了所謂台灣電影近年來最為肅
287,殺的場面，這個場面震攝人心的，並不是他的規模或是什麼真實性，而是製作團隊選擇
287,慢條斯理的讓這場戲緩緩地進行，由於過程既慢且冷沒有什麼激烈快速的運鏡與剪輯，
287,切都是宛如日常般的鏡頭處理，因此對觀眾的心理壓力自然也大，我得說這在好萊塢
287,韓國與香港其實都並非首創，但是在台灣電影就難得可以看得到這種處理，可見製片團
287,隊勇於突破台灣電影舒適圈的膽大妄為
287,最後，陳桂林完成了他的使命，自首後直到吃了最後餐的戲，切也是緩緩地進行，陳
287,桂林慢條斯理吃了最後餐，坦然接受制裁，電影最後給了他個臉部特寫，此時的陳桂
287,林露出愉快的笑容，他完成了人生最想做的事情，此時的他相當的快樂
287,但觀眾應該是看
287,得五味雜陳這個人到底是不是好人
287,他有做壞事，但也有做好事，他有自己的原則，可
287,是好像又太激烈了點，但是觀眾應該也都能理解他的選擇與價值觀，因為電影描繪得很清
287,晰又清楚，切只在於觀眾自己是否能認同這個價值觀罷了
287,給了個能讓觀眾想個不停的結局，周處除三害到此已經成功了
287,對我而言，周處除三害應該可說是今年我看過最為有趣的台灣電影，它突破了過去台
287,灣作品的總是語焉不詳流於過多喃喃自語卻又經常沒有結論的通病，給予了個簡單明
287,瞭的故事劇情，然後用這個故事框架填入相當有特色與個性的角色，讓這些角色互相衝撞
287,，以此產生劇情的張力，也因此讓觀眾看得目不轉睛，而且片中的對白不多，大部分的時
287,刻都是讓演員用肢體語言與表情傳達訊息，而且這些訊息藉由精確的場面調度鏡頭與剪
287,輯，把重點呈現相當的清楚，不需要讓觀眾像在看監視器般遠遠看著角色然後再猜他們到
287,底要幹嘛，然後又等得不耐煩
287,因此，周處除三害成為了步擁有明快故事節奏，擁
287,有娛樂性與幽默感，但是卻又能處處給予觀眾懸念的電影
287,雖然說周處除三害的故事體質，很明顯的帶有香港電影的氣質，但是這就像是沃夫岡
287,彼得森執導空軍號保羅范赫文執導機器戰警雷利史考特執導神鬼戰士
287,吳宇森執導變臉樣，這些創作者從德國荷蘭英國香港到好萊塢拍片，讓美
287,國電影擁有更多的可能性
287,而在台灣，過去胡金銓與李翰祥從香港來台灣，馬來西亞的蔡明亮也曾經讓台灣電影產生
287,了次又次的質變，如今台灣又有了周處除三害，我相當期待之後這種合作能夠為
287,台灣電影帶來更多新的質變
287,///_
288,雷文防雷資訊頁
288,香港導演真的很會拍，把阮經天每個鏡頭都拍得很帥
288,劇情架構很像在玩遊戲，關接著關
288,然後動作武打拍的淋漓盡致，血漿也噴很大噴不用錢
288,預告好險只把其中部份精彩的剪出來
288,後面的劇情真的看得更是大快人心
288,~~~~~~~~~~~~~
288,~~~~~~~~~~~~~~~~~~~雷文主文分隔線~~~~~~~~~~~~~~~~~~~~~~~~~~~~~~~~~
288,這部預告片出來的時候，就已經在期待了
288,好久沒看到這麼節奏明快的動作國片了
288,這部外表看似黑道片，實際比較像現代江湖片
288,主角陳桂林設定的價值觀很簡單，就是要出名
288,但他選擇出名的方式是殺黑幫要角出名
288,這個設定就可以讓觀眾去思考，他這樣做算是好人還是壞人
288,劇情方面就不贅述了
288,我覺得這部最精彩的是陳桂林在靈修中心的那段戲
288,改前面的武打動作調性，轉而探討主角心靈的部分
288,剛開始還真的以為牛頭仔已經死了，主角洗心革面加入靈修中心
288,以為劇情到這就會結束，沒想到峰迴路轉
288,這個靈修中心是有問題的，而且隨著主角抽絲剝繭，發現了牛頭仔就是尊者
288,接下來陳桂林拿著槍，用槍有沒有卡彈來決定尊者的命運
288,靈修中心的人坐著不動看著陳桂林，這邊看了覺得毛骨悚然
288,牛頭仔毫不意外被陳桂林殺了，中心的人依然還是唱著他們的聖歌
288,最後來到精彩的幕，也是爭議性最大的幕
288,主角給中心的人時間跑，留下來的人他就要殺掉
288,然後就看著他搶個爆頭那些信徒
288,有趣的是有些人因為卡彈，主角示意要放過他們，有個跑掉了，有個繼續留著
288,這裡的劇情真的很有嘲諷的意味，而且血漿噴很大，有昆汀的風格
288,這邊看得真的很大快人心
289,下午剛看完
289,整體給中上
289,節奏明快不拖泥帶水
289,阮的演技大爆發
289,都是蠻有看點的
289,以下有雷
289,~~~~~~~~~~~~~
289,~~~~~~~~~~~~~~~~~~~雷文主文分隔線~~~~~~~~~~~~~~~~~~~~~~~~~~~~~~~~~
289,阮的演技真的有驚艷到我
289,開始打戲的風格也很棒
289,阮和李李仁追逐戰的部份
289,真心覺得很少見國片可以拍出這樣的程度
289,只是我覺得李哥真的太勇猛了
289,般警察抓逃犯會這樣拼死命的單挑嗎
289,明知道武力值打ㄧ沒有勝算
289,還是拼死要追欸
289,少眼睛斷腿還是要追，真的很猛
289,不過前面追逐戰就看得出來阮並不是毫無意義的亂殺人類型
289,他幾次能幹掉李，都還是沒有下最終死手
289,中間開始除三害後
289,香港仔那段我覺得也是很棒的橋段
289,尤其香港仔這個角色的鋪陳
289,就是給人無惡不作的那種狠辣感
289,侵犯繼女言不合就想動手打死人
289,還有小弟笑的那段，給人的壓迫感真的很強
289,從香港仔問小弟笑什麼之後，就直在等什麼時候會突然拿酒瓶敲下去
289,果不其然，最後連砸七個，另外兩個小弟還很識相的先躲到外面抽菸
289,這段的壓迫感十足，也充分表現香港仔的喜怒無常
289,不過我很好奇他這麼衝動就想打死人的個性
289,怎麼可以躲這麼久
289,不過他都能發現阮躲對面旅館偷看他
289,至少索敵能力應該算是點蠻高的
289,理髮時阮被發現有嚇到我
289,最後香港仔因為看到警察而先行離開時
289,兩人有對視眼
289,阮露出了個小小的微笑
289,這個笑沒有很明顯，我覺得如果可以更放大或讓這個笑邪魅點會更好
289,讓香港仔不寒而慄那種，感覺張力會更強
289,後來不意外阮開主角威能單殺港仔
289,香港仔直問他給我個理由
289,阮用槍指了指眉毛上的傷疤算是給他個回應
289,香港仔應該到死都覺得莫名其妙哪裡惹到這個人
289,不過這種惡人自有惡人治的過程，還是蠻療癒的
289,接著到了尊者這段
289,有瞬間，我還真的以為阮得到救贖了，可以結束這殺戮的生
289,而如果真的就此停在這裡
289,直被騙都沒發現邪教真面目
289,對他何嘗不是種好處
289,即使身在謊言的世界
289,但他自己救贖了自己，也並非不是好的選擇
289,也或許這樣
289,才有些被洗腦到根深蒂固的弟子們
289,明明看到阮在屠殺
289,還是堅持要唱歌到最後吧
289,不過這種邪教還是殺了乾淨
289,卡彈就被放走這段也是蠻有趣
289,不然這個教派如果不殺完
289,定又會出新教主的
289,最後的死刑毫不意外
289,雖然觀眾角度看起來阮並非罪大惡極
289,但實際上他就是殺了十數人的通緝犯
289,播放整個死刑的執法過程也讓我們有了新的知識
289,奇怪的知識增加了
289,還有我想說的是
289,最後的餐看起來也太難吃了吧
289,其他劇情的小就不多提了
289,像是什麼媽媽帶小孩去邪教治病，被逼殺人就自殺
289,欸妳是來救小孩的，自殺了小孩怎辦啊
289,小孩又還沒死
289,整體瑕不掩瑜
289,還是算蠻好看的
289,推薦大家不知道要幹嘛可以去看看啊
290,前面那篇無法順利編輯，只好自刪\
290,好久沒有部商業電影讓我在戲院拍手叫絕，竟然還是台灣電影，周處除三害真的是
290,太驚艷
290,如果你喜歡台灣電影大多呈現的溫良恭儉讓，事件不溫不火角色不上不下，看
290,完只感覺到淡淡的，說了什麼又好像沒說什麼，周處除三害可能會讓你適應不良，因
290,為這是部有別於以往的台灣電影
