system_id,sentence
340,余香凝白日之下
340,王丹妮毒舌大狀
340,最佳男配角
340,姜大衛白日之下
340,謝君豪毒舌大狀
340,黃梓樂年少日記
340,李尚正死屍死時四十四
340,吳慷仁但願人長久
340,最佳女配角
340,梁雍婷白日之下
340,韋羅莎年少日記
340,廖子妤毒舌大狀
340,金燕玲不日成婚
340,楊偲泳毒舌大狀
340,最佳新演員
340,陳諾霆拍家族
340,謝咏欣但願人長久
340,何珀廉年少日記
340,吳冰人婚禮
340,許月湘白日之下
340,新晉導演
340,吳煒倫毒舌大狀
340,簡君晉白日之下
340,卓亦謙年少日記
340,李子俊第八個嫌疑人
340,祝紫嫣但願人長久
340,最佳編劇
340,毒舌大狀吳煒倫張雲青林偉文
340,白日之下唐翠萍李卓風簡君晋
340,命案游乃海李春暉
340,金手指莊文強
340,年少日記卓亦謙
340,最佳攝影
340,命案鄭兆強陶鴻武
340,金手指潘耀明
340,年少日記流星
340,白日之下流星
340,潛行關智耀
340,最佳剪接
340,金手指張叔平彭正熙
340,命案梁展綸
340,年少日記陳曉進卓亦謙
340,白日之下盧煒麟
340,毒舌大狀陳祺合
340,最佳美術指導
340,金手指林子僑
340,年少日記張蚊
340,命案余家安梁詩韻
340,白日之下潘燚森謝靄霖
340,七月返歸霍佩詩張栩冰
340,最佳服裝造型設計
340,命案余家安葉嘉茵
340,金手指文念中
340,死屍死時四十四黃家寶
340,白日之下潘燚森陳巧倩
340,但願人長久張叔平陳子晴
340,最佳動作設計
340,潛行錢嘉樂
340,爆裂點董瑋
340,命案黃偉亮
340,掃毒人在天涯李忠志
340,天龍八部之喬峰傳谷垣健治嚴華
340,最佳音響效果
340,白日之下楊智超
340,命案鄭名輝楊智超
340,第八個嫌疑人張凱彤
340,爆裂點聶基榮林紹儒陳慧思
340,金手指
340,最佳視覺效果
340,金手指黃智力潘志恒
340,命案張展榮周子豪覃彥
340,七月返歸陳迪凱水
340,斷網林洪峯林駿宇何文洛余國亮
340,爆裂點袁華堂王喜慶楊敏傑
340,最佳原創電影音樂
340,拍家族泰迪羅賓戴偉
340,填詞Ｌ王建威
340,白日之下朱芸編
340,金手指戴偉
340,年少日記區樂恆廖頴琛張戩仁
340,最佳原創電影歌曲
340,日光漂白白日之下
340,詞周耀輝曲朱芸編唱黃妍
340,毋忘拍家族
340,詞梁栢堅曲戴偉唱謝安琪
340,'金手指
340,詞劉敬雯曲戴偉唱大
340,填詞魂填詞Ｌ
340,詞黃綺琳曲唱謝雅兒
340,個人走走人婚禮
340,詞王澄晞曲唱岑寧兒
340,最佳亞洲華語電影
340,孤注擲│申奧│中國
340,富都青年│王禮霖│馬來西亞
340,滿江紅│張藝謀│中國
340,周處除三害│黃精甫│台灣
340,關於我和鬼變成家人的那件事│程偉豪│台灣
341,無聊看了下三千八百萬好像也停陣子了
341,以台灣電影來說算不錯，不知道有多少包票就是了
341,七年前的赫茲我愛你票房為萬
341,魏德聖嘗試些比較軟調題材的好像都不好，只有海角七號飛衝天而已
341,他電影問題就不少，拍些軟調的就很明顯看出來，
341,台灣電影近期破千萬的
341,赤心巔峰
341,小曉
341,惡女
341,女鬼橋
341,周處除三害
341,這樣有辦法為他籌措到台灣三部曲資金嗎
342,阮經天周處除三害血腥尺度突破天花板中國上映被要求二次閹割
342,曾宛如壹蘋報導阮經天在主演的周處除三害展現突破演出，入圍金馬影帝，在
342,台灣去年月就上映，在中國則被安排在月日上檔，先以小規模點映試水溫，結果好評
342,如潮，中國觀眾誇尺度勁爆生猛，不只是血腥畫面上，包括劇情表現出來的以暴制暴
342,的觀念，都突破中國尺度天花板，被問到底怎麼過審的，其實中國試映時，因為他們
342,的審查制度嚴格，已經是做過特殊處理的閹割版，結果試映熱度太高，傳有觀眾反映
342,部分畫面少兒不宜，又被叫回去修改了些內容，雖然如此，因為口碑已傳開，中國上映
342,票房被看好，光點映目前已賣破萬人民幣約萬台幣
342,中國電影沒有分級制度，每部獲准上映的電影，所有年齡的觀眾都可進戲院看片，因此採
342,事前審核，尺度偏嚴，雖然周處除三害月日正式上映時是次修改版，但尺度話題
342,已引發網友好奇，本來是票房大利多，不過也將在月日同步上架周處除三
342,害，而且是尺度比較大的版本，不知道會不會對中國票房有所影響，大家都等著看
342,///
343,///
343,昨天非假日，周處除三害光靠點映就拿到了上海地區的票房日冠軍
343,明天正式上映
343,老實說我自己去年十月份回台灣雖然耳聞周處除三害但是沒看，至今也沒有看過
343,但是最近在上海的微信藝術相關群組真的是超級多人在討論這部片
343,很多人衝著今天是次
343,閹割版搶票去看
343,明天正式大規模上映二次閹割版聽說會多很多馬賽克畫面，不知道能不能維持熱度
343,我自己
343,是決定我還是看原版好了
343,就不去電影院看了
343,_
344,簡單說
344,蠻好看的爽片啊
344,阮經天演的還不錯
344,就商業片而言很成功
344,港仔的惡是惡在表面
344,騙子的惡是侵入內心
344,尤其是腦殘的人
344,沒有資格活著
344,而且最後阮也被槍決了
344,如果是現在的台灣
344,應該不會死吧
344,我看微博討論熱度很高
344,有可能是部票房大黑馬
345,有幕很奇怪
345,第幕李李仁在追阮經天的時候幹嘛不拔槍
345,阮經天在殺香港仔時幹嘛不開始就拔槍
345,還要番打鬥最後用槍殺了他
345,另外阮經天不是被刀捅進心臟嗎
345,居然沒死，而且被活埋居然還有辦法爬出來
345,最後那幕那些信徒居然沒全部跑走
345,也蠻扯的
345,","
346,因為我個人滿喜歡看國片的
346,裡面常常出現個角色
346,陳以文
346,我覺得他演技很好
346,眼神語氣講話的感覺
346,每次都讓我覺得這演員真的很強
346,陽光普照瀑布周處除三害
346,路順風大佛普拉斯同學麥納斯等
346,感覺好多電影都有他
346,雖然不是主角
346,但演技很強大
346,推薦下這位好演員
347,推薦部
347,周處除三害
347,這部真的爽片
347,最後大屠殺真的只有超爽
347,起承轉合都非常棒
347,只能說的囚犯
347,真的是根本是邪教教主
347,還滿屌的
347,裡面的信眾也被洗腦的很徹底
347,最後那段看完只有爽快
347,大推這部
347,好看
347,過癮
347,阮經天也很帥氣
348,以下有雷
348,______________________
348,只要接受主角光芒太厲害
348,阮經天有驚天的復原能力和抗打能力
348,這樣的設定之下
348,那就是部好看的邪典電影
348,真的滿好看的
348,動作設計也很到位
348,刑警陳灰根本是巴柔的高手但量級就是比桂林仔小力氣不夠大
348,細節氣氛運鏡色彩都是上乘之作
348,阮經天左眉的疤直很連戲
348,台中綠川看了就很有情懷
348,有沒有人真的邪教精舍的拍攝點在那裡呢
348,看起來很漂亮想去旅遊參觀
348,雷文防雷資訊頁
348,~~~~~~~~~~~~~
348,~~~~~~~~~~~~~~~~~~~雷文主文分隔線~~~~~~~~~~~~~~~~~~~~~~~~~~~~~~~~~
349,周處除三害的英文片名是豬蛇鴿
349,刀見笑的英文片名是豬蛇雞
349,基本上兩部片都是三個主要人物代表三種動物，兩部片的三種動物都是從貪嗔痴來的
349,還有那些片也是類似的片名跟含義嗎
349,_
350,新聞網址
350,////
350,_
350,阮經天登中國票房哥
350,周處除三害破億好奇刪哪狂奔戲院
350,//
350,記者陳穎台北報導
350,///////
350,▲阮經天主演的周處除三害在中國大受好評
350,圖翻攝微博
350,男星阮經天主演電影周處除三害自本月日起在大陸上映，由於試映會時被指太過血
350,腥而刪減少片段，引發議論，同時間因為上架該片，本以為會影響票房，沒想到
350,因為刪減過的版本更讓人好奇，截至目前為止，周處除三害天票房已經突破萬
350,人民幣約新台幣億元
350,陸網分析試映版上映版原版版本不同，吸引民眾好奇進電影院朝聖周處除三害
350,根據貓眼電影數據統計，票房目前排行冠軍，上映天突破萬人民幣約新台
350,幣億元，擠下了上映超過天的陸片包括第二十條飛馳人生動畫熊
350,出沒逆轉時空熱辣滾燙
350,///////
350,▲阮經天在周處除三害演技大突破
350,圖翻攝微博
350,中國電影沒有分級制度，周處除三害在台灣上映被列為輔級，可是在串流平台
350,是設定
350,中國媒體報導，周處除三害並未如網路謠傳刪減，而是為了讓畫
350,面看起來舒服而做了後製處理，試映版正式上映版與原版皆是分鐘
351,"之前就聽聞這部票房不錯,以及相關爭議"
351,"結果前天看到飛上了,立馬點來看~"
351,~~~~~~~~~~~~~
351,~~~~~~~~~~~~~~~~~~~雷文主文分隔線~~~~~~~~~~~~~~~~~~~~~~~~~~~~~~~~~
351,"其實題材對我來說還好,但看了後面陳桂林對待邪教,真的是整個驚艷"
351,"直接好雷了~很少戲敢這樣演,尤其偽善又衛道的台灣"
351,"陳桂林排名通緝榜第三大,開始為了奶奶挺而走險犯罪,但奶奶也知道這錢來歷,毛都不用,後來奶奶走了,又因肺癌第期,而有不同體悟,決定大幹票讓世人記得他名字"
351,也成功了
351,"最後小美在獄中幫他剔鬍子,他流下了眼淚,應該不是怕死,而是想不到還有個關心他的人"
351,"程小美有人說她其實可有可無,但她的戲份有帶到點香港仔從別人手中救出她媽陳桂林又適巧香港仔手中救出小美,有時是種環境問題,為何社會新聞常有女子被暴力對待,甚至死亡,還是不離開這類人渣"
351,"是有些女子覺得,離開了換個人還不是都樣"
351,"現實中,""英雄救美""大多是電影漫畫情節"
351,"張貴卿地下藥醫師,初見下長的很像我們尊貴的蔡總統已修正用詞,勿戰,而演出時想說她怎麼沉悶無生氣,後面真相大白,原來時日無多,愛兒怎麼辦"
351,"才想說是否長期幫忙道上弟兄的報應,想做做善事彌補吧"
351,"香港仔通緝榜第二,演出中規中矩,不過有幾幕氣勢不錯,另那時有回憶了下,台灣當初十大通緝犯,外國人嗎"
351,印象最的還是陳進興張鍚明等人
351,"林碌和通緝榜第,轉職為""尊者"",這類邪教,常利用人的急迫需要或心靈空虛,斂財斂色開後宮"
351,"後來陳桂林要槍殺前,想說林怎麼那麼淡定"
351,有了權勢金錢難道不怕死失去
351,","
351,"再重看了次,前槍他臉部有抽蓄了下,只是沒什麼大動作,叫信徒組人牆,最後被爆頭"
351,"原先我覺得束以待斃有點不合理,但後來想想,是不是林本來就對""生命""較麻木無感,包括他自己的,"
351,"因他有說,隨便場天災死多少"
351,多殺幾個又怎樣之類的~所以自己死了就算了
351,"陳灰人出場身上就帶戲,可惜戲份不多,這個角色我才覺得沒有也沒差"
351,"最後還是要提,肅清邪教那段~或許有人覺得說,留下的信徒無所有或迷信沒救,但罪不致死"
351,"但,當他們個個喊""殺"",霸凌甚至殺害質疑反抗的人時,是否都是共犯"
351,"螢幕中個個信徒竟看著割頸刺胸濺血都能面不改色,可見已習以為常,到底還有多少是這樣直/間接死在他們手裡的"
351,"最後陳個個槍決,或許是中間有被騙病情好轉,痛苦流涕想改過,聽到歌森"
351,"還是覺得這些人,將來可能又會再害人換尊母繼位,肚裡的再繼承,那倒不如再當做好事,剷除真正""執迷不悟""的人"
351,"最後就是笑著服刑,或許當下是因成名而笑,或許是覺得除掉自己也是好事,也不會跟醫師騙他的事計較,總之,光後段就值回票價囉~"
352,看最近周處在對岸爆紅
352,看下無非就是反邪教尺度大暴力美學
352,去年這部上的時候挺無感的
352,看到吹成這樣網飛又剛好上就看了下
352,還行吧算是能順順看完的水準
352,至於對岸狂吹的尺度我是不知道對岸的審核啦
352,我個人是覺得還好沒啥感覺
352,是我太冷血還是尺度真的沒什麼
352,最後想說下那個女醫生
352,那個造型真的沒有在某人嗎
353,之前被講爆雷
353,再來強力推薦下好了
353,這部是我除了富都老狐狸跟小曉外
353,唯片去院線看的
353,我還是要說很值得啦
353,非常爽的商業片
353,尤其是阮經天下班後
353,剩下的宗教智障再度奏起音樂的時候
353,阮經天那個表情有夠經典
353,就好像在說除惡務盡啊
353,接著開始大屠殺
353,哪瞬間就爽翻了
353,看富都是沉重的壓抑
353,小曉是小姑娘精彩但就精彩而已
353,老狐狸男主角應該是陳慕義吧
353,而周處除三害就是爽爽爽
353,不少豆瓣評價黃精甫也有資格拿金馬最佳導演我也是很認同的
353,現在網飛訂下去或等待租
353,我覺得周處不會讓你失望的
353,老實說的金馬比上屆精彩許多
353,另外再次推薦條以中共的審查周處跟條能上映
353,確實很難得
354,如題
354,我朋友還沒看，但有先看預告
354,///
354,我朋友很疑惑
354,預告片這個脫褲子壓頭的畫面
354,男女雙方是在幹什麼
354,我朋友說應該不是我想的那樣吧
354,難道今天硬了嗎
354,那麼問題來了
354,他們在幹嘛
354,是我朋友想得那樣嗎
354,大家覺得呢
354,這部片到底是不是老少咸宜
354,預告片段用胯下對著女生並且做壓頭的動作是要幹嘛
355,雷
355,前兩名槍擊要犯
355,逃了不知道多少年
355,然後第三名得到些情報後就能在~個月內找到人並且替天行道
355,重點第三名自己也逃了四年也沒易容就是戴個帽子蓄鬍
355,這種人才為何不乾脆政府單位吸收
355,就像電影火燒島樣假槍決真吸收
355,找到第二名還覺得很合理畢竟知道第二名有人固定來拿頭痛藥
355,能找到第名根本就是名偵探
355,光看本書從書後面的地址就可以推理要去澎湖找線索
355,這種人才根本個抵十個
355,再者片名都叫周處除三害了
355,周處除掉兩害後也沒死反而做官官位還做到比老爸高
356,先講講常見人家批評的點
356,這部電影縫合怪
356,我覺得嘛縫合拼貼在現在這個時代已經算是個流派了換個角度
356,部電影能多重享受比較對現在人的口味了
356,程小美多餘
356,說這角色多餘我是不認同的是性別不對如果角色是未成年男童的話
356,拯救未成年男童就是進步價值
356,陳秋多餘
356,法網恢恢疏而不漏安全網就是這樣的
356,我覺得拍得好的點
356,陳桂林是真蠢
356,被醫生騙去投宿目標開的旅社主動露出底牌很多電影主角在緊要關頭會莫名長
356,出智慧這部沒有陳桂林人設可能夠橫夠幸運但始終如的蠢難能可貴啊
356,第第二敗在傲慢
356,老馬是香港娛樂常用的套路不像外國片壞人沒梗硬塞死於話多亞洲的壞人是總是花篇幅
356,把人玩弄於掌間牛頭甚至傲慢到自己以為能躲過九槍笑死事與願違看壞人勞心勞力最
356,後白忙場真的很搞笑
356,回歸宣揚傳統道德
356,嘛以現在來說要講人死留名虎死留皮英雄救美不劫色改過自新悔過向善法網恢恢
356,惡有惡報這些教條應該會被罵說教太重老調重彈吧可是這部戲的道德思想卻是講這些
356,基本現在人已經很少去在意的傳統觀念反而給人種新鮮又懷舊的感覺
356,講得很瑣碎但總之就是這樣我滿喜歡這部片的值得看
357,看完直有個疑問
357,就是電影中提到十多年前林祿和從黑道醫生處寫信給他母親那段
357,後來母親回信到醫生那，陳桂林拆了信看到裡面有他母親的四句教誨
357,之後在他母親遺物中發現裡面有本宗教文宣背面就有那四句話
357,至於為什麼母親的遺物會有那份文宣，只能理解為是林祿和後來寄給母親的
357,不過林祿和不是沒有收到回信嗎
357,那四句話又是怎麼被印在文宣背面的呢
357,還是我根本就理解錯了
358,雷文防雷資訊頁
358,~~~~~~~~~~~~~
358,感謝迅速上架，這種體感冷爆的天氣，再想看的電影都無法讓我步出家門
358,當初這片上映時，就有心動想看
358,因為很快衝了且懂我的朋友說好像不看大銀幕也沒關係
358,我就躺平等串流
358,如今看來，友人懂我
358,這片好和不好都很明顯，專業演員表演很棒，非專業演員表演很尬
358,不確定是不是因為導
358,演是香港人的關係，最好的對白是廣東話的部分，最好的戲是邪教聚會現場
358,前三分之的敍述較慢，但後半部分可稱痛快
358,起看的室友看完之後，連邪教詩歌都會
358,唱，可見洗腦程度
358,聽說預告很爆雷，若有興趣的人，不要看預告直接看可能會比較好~
358,這裡是我的樂園
358,/////
359,周處算是很好的商業片
359,就算不能像鬼家人那樣賣到億
359,最基本也該破億吧
359,結果台灣觀眾是怎麼對待這部好片的
359,票房三千多萬
359,這絕對賠本啊
359,堆台灣人等到這部片在中國上映廣受好評
359,才跟著吹周處
359,那當初上映時你們怎麼沒進場貢獻票房
359,還有多少台灣電影不像周處樣有機會在中國上映而被埋沒的
359,台灣觀眾真的對不起台灣電影
359,以後台灣觀眾沒有資格去罵藝人舔共了吧
359,連票房都不貢獻
359,害國片賠錢
359,憑什麼要求人家不去追求中國市場
359,人家賈玲部賀歲片的票房
359,就抵台灣全年所有電影的票房
359,這麼誇張的差距
359,劉冠廷王淨朱軒洋王渝萱這些演員
359,趕緊前進中國拍戲吧
359,台灣這個市場對不起你們
359,不能把你們捧成巨星
359,快去中國發展吧
359,張鈞甯拍年中國電影賺的錢
359,劉冠廷拍年台灣電影都賺不到
359,看到劉冠廷跟孫可芳都要快要生小孩了
359,還在跟別人起租屋
359,這是劉冠廷這種等級的演員該有的待遇嗎
359,快去中國發展吧
359,偶爾講些舔共的話也沒關係
359,張鈞甯的台灣代言也沒少啊
360,雷文防雷資訊頁
360,~~~~~~~~~~~~~
360,~~~~~~~~~~~~~~~~~~~雷文主文分隔線~~~~~~~~~~~~~~~~~~~~~~~~~~~~~~~~~
360,怕雷到人，所以標題不寫詳細點，我想問的是
360,在電影開場陳桂林先殺了黑道老大洪爺後，接著應該是被黑道下達通緝令
360,猜測應該是被洪爺的拜把兄弟或者是繼承人之類的，叫鐵頭哥的下黑道通緝令
360,接著陳桂林就跑來洪爺的告別式，再開槍幹掉鐵頭哥
360,在開槍幹掉鐵頭哥後，加上也有刑警在場外監控防止滋事
360,這點蠻符合台灣的現況，些黑道老大的告別式都會有刑警在場外錄影
360,但因為槍聲太大所以驚動到警察，這時候陳桂林要逃跑時，有幕是把槍丟在草地
360,接著才上演警匪追逐戰，但後來刑警陳灰的槍其實有被陳桂林搶走
360,為什麼陳桂林要把把犯案的手槍丟在地上
360,把槍黑市價也不便宜欸
360,然後丟了原本犯案用的手槍，再去搶警槍來用，只為了鋪陳劇情後面的
360,陳桂林自首後將警槍交還給陳灰這段
361,"對,除窩蜂外,還有什麼阿北閒雜人等,感覺都是""人頭"",才想說是不是很久以前台灣那個勸自首繳槍的事情,總之,愈看梗很多"
362,我覺得你根本搞不清楚
362,對岸演員搶資源有多競爭
362,這些人在台灣都搶不到資源了
362,到對岸跟人家大公司大團隊搶資源
362,你以為是搶得贏嗎
362,隨便個流量小生小花
362,就把他們壓在地上摩擦了
362,就算他們演技爛得可怕
362,但他們有粉絲就流量
362,演技說真的也比不上對岸的老戲骨
362,以前能過去發展的
362,大部分都是在台灣就已經紅的藝人
362,同時作品也有紅到對岸的
362,就算是王大陸
362,也有部爆紅的我的少女時代
362,你講的這些人有
362,哪部現象級爆紅的
362,許光漢都接不到什麼好角色了
362,這些人去對岸就只是路人甲乙丙而已
362,除非全部簽賣身契給大公司讓人家捧紅
362,但請問他們都幾歲了
362,過去想要好好演戲是不太可能啦
362,當當綜藝咖撈撈錢倒是有可能
362,但不會有什麼好作品
363,覺青這不是要我跪著嗎
363,寒磣
363,很他媽寒磣
363,那你是想站著，還是想掙錢呢
363,覺青我是想站著，還把錢掙了
363,敢問九筒大哥何方神聖
364,周處除三害的陳桂林原型很明顯就是劉煥榮
364,這讓我想到看台灣啟示錄台灣其實過去有意思的案件真不少
364,為什麼台灣導演們不多利用這些題材呢
364,舉個例子韓國電影就用了非常多社會題材
364,比如韓劇的信號少年法庭韓影追擊者等等
364,像是台灣名氣最大的白曉燕案
364,我理解人家家人還在又是名人不好去戳人家痛處
364,但像是陳新發張錫銘胡關寶這些悍匪明明都是很好的題材
364,為什麼不拍呢
364,隨便個胡關寶我就能想出套劇情了
364,主角就用侯友宜當原型演他開頭抓到胡關寶後
364,用倒敘手段慢慢帶出集團團夥犯下的案件
364,電影最後再引用胡關寶臨死前說過的話
364,天底下沒有白吃的午餐你想要不勞而獲的話
364,有時候這個代價可能會非常的慘痛
364,也會給自己家裡朋友跟親戚帶來永遠不可抹滅的羞辱
364,我在此也呼籲想要作奸犯科的人能夠多想想自己的父母
364,完全是個正能量又能警醒世人的結尾
364,我隨便都能想出套劇情台灣的編劇為什麼不拍阿
364,而且去看這種片也不會有什麼大場面預算也不高阿
364,整天拍堆小情小愛文藝片又拍的沒韓國好
364,那大家看韓片就好
364,要大家支持國片就多拍些台灣自己的東西阿
365,這就是市場的影響力啊
365,當年港片最輝煌的時候
365,沒有中國市場
365,但星爺的電影可以在台灣以及整個東南亞拿到五倍甚至十倍的成本收益
365,成龍因為在日本的票房地位
365,使他在年代末期片酬就高達萬港幣當時成龍的部片酬足以購買香港太古城個
365,大廈單位
365,墨鏡王也才可以在氣病鄧光榮後
365,還可以從學者蔡董手上拉到多萬港幣的投資
365,邵氏跟嘉禾都有行銷全球的電影通路
365,而台灣市場是當時最重要的指標只要在台灣大賣的電影
365,就會橫掃東南亞華人市場
365,最牛逼時台灣甚至直接封殺影帝梁家輝導致全港電影公司沒人敢讓他拍片整整三年多
365,現在換中國了即使中國經濟明顯下滑但人口基數擺在那
365,每年電影總票房還是持續上漲
365,實話說我覺得條打錯了比周處深刻
365,但周處確實很爽可是台灣自己定位要清楚吃到中國奶水
365,並不是常有的事
365,小成本不見得沒有巨大的票房成功
365,雖然吃不到中國市場但孤味富都青年都是叫好叫座的好作品
365,那麼片商跟導演要如何自己定位呢
365,話說許承傑很久沒有作品上映了
366,老實說去年在電影院有打算看過
366,但是那個片名軟今天的海報笑容
366,看起來就很像賀歲搞笑片最後直接略過
366,這幾天上網飛突然很多討論就看了下
366,防雷喔
366,哇原來是類似韓國那種社會案件改編的動作片
366,這幾年台灣黑道片有個很鳥的地方就是要強調宮廟設定罵髒話
366,這部用黑道殺手全程沒什麼髒話的感覺不是也能拍出好片子嗎
366,動作戲的預算感覺都放在開頭了李李仁軟今天的肉搏不知道有沒有用替身
366,意外打起來效果還不錯還有巴西柔道的動作
366,後面那場香港仔就有點在亂打的感覺香港仔前面那個拿剃刀威脅人的時候還以為很會打
366,結果後面上演亂拳打死老師傅有點虛
366,邪教篇應該是本片大亮點
366,我本來以為台灣不可能拍出這種大屠殺的場面
366,沒想到槍槍暴頭還穿插卡彈夠黑色幽默我喜歡
366,台灣第的槍擊要犯轉型邪教尊者以後居然就不帶槍在身上了我本來還以為會有槍戰對決
366,結果他居然開始賭軟今天會連卡九彈真的是騙人騙久了連自己都騙下去
366,結尾前女醫生爆料原來肺癌的不是軟今天而是她這有點出乎我意料之外
366,原來她才是真正的周處
366,但軟今天沒說太多心理話就莫名接受了覺得轉得有點硬
366,後面把死刑演出來就覺得說教意味很濃了
366,尤其看中國人堆在稱讚說把死刑演出來很有正面教育意義
366,我反而覺得滿滿說教臭味
366,就停在小美到監獄幫軟今天刮沒刮完鬍子他流淚的那個鏡頭就好了
366,後面那段死刑要是在電影院看場子感覺都冷掉了
366,但總結來說我覺得這是黑金以後第二部用台灣社會案件改編表現還很不錯的電影
366,年代那個槍擊要犯滿街跑的時代現在想想根本是題材寶庫吧
366,黑道火拼或黑道殺手
366,都比演堆宮廟在那邊罵髒話好看多了
367,雷
