system_id,sentence
190,約億台幣，阮經天於微博曬出劇組合照，寫下最好的群人，讓這切都具
190,有意義，謝謝你們
190,不少大陸網友恭喜他主演作品取得票房佳績，成呼喚他也到大陸參
190,加活動，露面下
190,據陸媒報導，截至日零點，周處除三害的票房已突破億，打破王大陸與宋芸樺主
190,演我的少女時代於大陸上映總票房億約億的紀錄，也在大陸電影網站取
190,得高評分，而電影仍熱映中，票房持續漲
190,阮經天的演技及外貌狀態也因周處除三害
190,在大陸熱映，覺得阮經天保樣也太好，網友還貼出各種陳桂林表情包，讚演得好
190,而周處除三害於串流平台上線，不僅在台灣香港持續排名第，在新加坡
190,馬來西亞南韓印尼越南也衝進前十
190,此外，據中時電子報報導，周處除三害傳於大陸上映是被大陸片商買斷，以至於
190,監製李烈無法獲得大陸票分收益分潤，李烈否認此說法，表示是有本金加分潤的
190,完整新聞連結或短網址不可用等轉載媒體
190,//////
190,_
190,備註
191,最近電影周處除三害很紅，
191,裡面周處的原型劉煥榮也被熱烈討論
191,不過當年劉煥榮被日本遣送回台時，
191,日本可是完全不把劉煥榮當人看，感覺是當牲口
191,根據坊間很不容易找到的前警政署長盧毓鈞回憶錄
191,日本法官深夜審理並在凌晨四點同意立即遣返劉煥榮
191,，以刑事警察局副局長身份到日本負責此案的盧毓鈞
191,親眼目睹劉煥榮當時的慘狀
191,當日本遣返劉煥榮時，機場實施演習，並使用貨櫃車
191,將劉煥榮裝在貨櫃中，像貨物般頭下腳上運上飛機，
191,這時的劉煥榮嘴巴裏被日本警方塞滿了紗布與棉花
191,，且用繩子將嘴牢牢纏住，導致劉滿口鮮血，情況非
191,常狼狽與不堪
191,我們也臨時把該飛機商務艙整個包下來，安排劉煥榮
191,待在那，而讓商務艙的客人升等到頭等艙
191,日本警方可是不用簡單的膠帶黏上了事
191,劉煥被榮以頭上腳下綁在椅子上，塞進貨櫃
192,我覺得有點覺青欸
192,軟莖天又帥又酷不說
192,很吸引甲甲票房
192,玩射擊遊戲滅了邪教
192,讓更多無知靈魂不被騙
192,然後江湖賣藥女醫生騙就除了三個害
192,也算是妙招
192,再搭個正妹王淨平衡下吸點直男的票
192,主要還是吸女生/甲甲
192,這部是覺青電影吧
192,有沒有八卦〓〓
192,我覺得裡面蠻帥
192,我支持死刑
192,虐童虐貓割喉的全去死光光
192,屁啦我覺青我很愛啊
193,陳桂林在周處除三害裡
193,留下很多語錄
193,跟關二爺擲個聖杯要自首
193,陳桂林去兒福聯盟門口會說什麼
194,阿肥看完周處除三害了很普的部片
194,裡面有幕有點意思，王淨對軟今天說你看起來不像臺中人
194,///
194,阿肥百思不得其解，長這麼大也沒被人這樣說過，所以台中人是有什麼特質看就知道
195,平台可以集資，讓憂鬱躁鬱的瘋子或很缺錢的小混混去教訓虐童的人渣或強奸犯，給你筆安家費教訓畜牲，大家花錢也開心，周處除三害，這平台有沒有搞頭
196,幹
196,腦弱的我因為看到網路跟版上到處都在洗周處除三害
196,所以點來看了
196,陳灰明明只有把名片給女醫生
196,女醫生也沒把陳灰的名片給陳桂林
196,陳桂林最後是怎麼打電話給陳灰自首的
196,不是轉接喔
196,因為他開口第句話就是陳灰
196,幹，桂林仔去哪邊得到陳灰的電話的
196,有沒有卦
196,操你媽又臭又長兩個多小時還好我是在家看
196,在電影院看我肯定尿了褲子
196,電影長度還是盡量能在分鐘以內演完好嗎
197,周處除三害的香港仔
197,大家討論最多的就是他跟王淨劇情
197,但是我看的覺得他很厲害的點
197,竟然能夠發現有人監視他晚
197,這不是耍狠而已
198,大家好，
198,小弟文組業餘電影觀賞家
198,如果許瑋甯說周處除三害女主角會怎麼樣
198,床戲可不可以都是真槍實彈打真軍開肛
198,超越梁朝偉的色戒，
198,早就拿金馬獎，金獅獎了吧
198,是不是
199,///
199,看了這解說
199,原來
199,周處除三害其實
199,還有三個象徵物在裡面
199,坦白說
199,如果沒看第次看我鐵定看不懂
199,有誰注意到豬貼紙跟卡通表都有豬的
199,包括香港老大的刺青應該也沒人注意到是刺了什麼吧
199,還有最後周處處決的表情跟造型原來也是好的
199,現在拍個電影沒有特效跟群星的話
199,就是要想辦法塞很多細節吧
199,不知道在拍的時候，那些演員知不知道
199,導演想傳達的理念
199,有沒有掛
200,其實我也不懂會有人嫌個拿過台北電影獎最佳女主角獎以及分別都兩次入圍金馬獎跟金鐘
200,獎的年輕女演員演技不好
200,最好笑的是有人說他在瀑布裡就是演自己，然后演自己演到入圍金馬獎，笑死
200,這讓我想到個圖，坐在沙發上的肥胖阿宅指著選美佳麗說她的鼻子太大不好看
200,///
200,回到周處除三害，雖然她側身全裸的樣子很正，但那角色也不能讓她發揮什麼，因為那就是
200,個被長期壓榨並當成性奴隸的小女生，唯唯諾諾的只能聽從香港仔的指示，把頭壓下就要
200,準備口交的地步，只能像小狗樣小心翼翼地不要讓香港仔生氣，事後探望陳桂林才能解放
200,原有的笑容，個人覺得是有達到年輕女演員中上的水準，畢竟她才歲，可塑性還有，不是
200,嗎
200,","
201,如果今天是我們殺神基奴李維基哥
201,翻拍周處除三害的陳桂林
201,要怎麼演才能超越阮經天~~
202,阮經天
202,代表作
202,艋舺金馬影帝
202,軍中樂園
202,周處除三害金馬入圍
202,張震
202,代表作
202,牯嶺街少年殺人事件金馬入圍
202,最好的時光金馬入圍
202,吳清源
202,繡春刀金馬入圍
202,龍先生
202,緝魂金馬影帝
202,劉冠廷
202,代表作
202,陽光普照金馬最佳男配角
202,消失的情人節金馬入圍
202,詭扯金馬最佳男配角
202,這三位優秀的台灣男演員
202,都拿過金馬獎
202,大家覺得誰演技最好
202,我叫陳桂林，我有名有姓，以後不要再叫我什麼桂林仔
203,周處除三害是好電影
203,台灣只賣萬台幣
203,稍嫌可惜
203,阮經天表現精采，但他去中國發展多年，在台灣比較不受歡迎
203,沒有票房號召力
203,如果改成當今台灣最紅小生許光漢來演桂林仔
203,應該很有機會破億吧
203,不過阮經天去年演了三部國片
203,車頂上的玄天上帝客串
203,查無此心算男，但電影核心是張鈞甯
203,周處除三害男
203,相信名氣會慢慢回來的
204,這兩天看完周處除三害
204,覺得這個女醫師真的很突兀
204,短髮細框眼鏡
204,看起來很正經，不能開玩笑
204,講話像讀稿機，毫無情緒波瀾
204,///
204,還有另個男醫師，中分龜頭，也很眼熟
204,///
204,真的是巧合嗎
204,這兩個醫師的裝扮都很眼熟，有沒有卦
205,///
205,///
205,周處除三害的陳以文
205,演員名單比王淨前面
205,以前不認識他
205,現在認識他了
205,原來是尊者
205,他算大咖嗎
205,有沒有八卦〓〓⊙⊙〓〓
206,各位水水安安
206,各位帥帥安安
206,各位肥宅安安
206,大家好唷
206,小妹想要問問大家個問題
206,問問看唷
206,周處除三害裡面那個香港仔演技是不是超級好
206,看到他出場覺得好害怕
206,查了下
206,叫做袁富華
206,感覺他很適合演海大富
206,有木有更多相關的八卦呢
206,嘻嘻
207,大家好，我福建彭于晏
207,前陣子有人提告周處除三害抄襲
207,苦主是你們台灣人導演
207,文中提到抄襲的有些很搞笑的點
207,原著叫陳廣州，電影陳桂林
207,感覺叫陳雲林比較好，有台灣價值，畢竟黑道故鄉
207,原著陳火，電影陳灰
207,原著是腦癌，電影肺癌
207,原著博了次聖杯，電影次
207,原著陳桂林排名第，電影排名第
207,現在港台導演互撕抄襲
207,我們中國觀眾只是在旁邊的吃瓜群眾
207,十幾年前的台辦主任，這個干麼
207,重點雲林，雲林
207,黑道江湖浪子回頭的故鄉~
207,多有台灣味
207,那是張銘清啦，被王八千撞倒
208,詐騙集團是現在塔綠班重點保護對象
208,非常之呵護，這種案例不勝枚舉
208,上次有洗錢億的詐騙集團全部交保
208,讓他們可以繼續營業不耽誤詐騙工作
208,蒸的很會，很棒的塔綠班
208,民眾看不下去也毫無辦法，希望國民黨可以即刻修法把詐騙集團判死刑
208,然後學下周處除三害
208,數到十，不走的槍個，爽
209,隨著周處除三害的爆紅
209,尤其是片尾的大屠殺
209,表示大家都被壓抑太久了
209,隨著每天堆狗屁新聞時事的發酵
209,如果現在開拍部私刑正義的電影
209,應該整個賣到爆炸吧
209,例如酒駕慣犯撞死人交保後持續喝酒，被人當街槍殺
209,虐童保母交保後遊山玩水，被人推下懸崖
209,淫魔狼師猥褻女學生後被人私下宮刑
209,等等數不勝數可以想到的大快人心場景
209,應該能重現國片奇蹟吧
210,周處除三害
210,最大的亮點就是王淨跟香港仔的交手吧
210,這段是不是導演是香港人
210,所以把最大的福利給香港仔
210,大家很羨慕吧
211,如果周處除三害
211,那個宗教
211,如果是
211,天地大家家盟
211,剛好古月方源正在傳教
211,大愛的信仰
211,看到拿槍的周處進來
211,會怎麼除掉大愛仙尊啊
212,小粉紅看了周處除三害覺得台灣好落後喔
212,黑道堆暴力槍枝氾濫通緝犯堆警方無能
212,封建迷信堆邪教這些就是民主價值進步嗎
212,根本就像舊社會
212,"更加深了我想""解放台灣""的決心"
212,在台灣受難的台灣人再忍忍
212,難道共產黨治理的中國沒有黑道槍枝氾濫邪教通緝犯滿街跑嗎
212,到底誰才是進步
212,有沒有八卦
213,前兩天看完周處除三害
213,真心覺得廢盟和裡面那個頭號通緝犯真的很像
213,殺幾十個人無所謂
213,天災地震死多殺人啊
213,然後阮今天個個打死，還是有人要留下
214,剛好想到
214,要是找號稱健身界的金城武
214,館長
214,要是他演周處除三害的主角
214,就是阮經天的腳色
214,劇情會怎麼演比較好呢
214,如何
215,我看中國那邊看到高潮爆紅
215,還說灣灣地方落後
215,我看那邊才落後吧
215,這種鳥片也能在那紅
215,害我被騙看這種鳥片
215,看到半受不了直快轉到結局
215,這什麼無聊的劇情
215,王淨全裸也沒啥看點
216,小肥還沒看過這部片
216,但是看了那麼多留言也可以猜得出應該是私刑正義之類的
216,小肥昨晚看了部片
216,片名希望為愛重生
216,是翻拍韓國真實事件改編
216,故事大綱是在說有位小女孩在上學的途中被性侵，事件帶給家庭的劇變，她與家人起
216,走出陰影的路程
216,其中有幕是小女孩的爸爸到監獄去找加害者談話
216,起初這個人渣想騙過爸爸表示自己當時喝酒並不知情
216,後來又刻意透露出當下的情況來刺激這位父親
216,而最後法院只判年有期徒刑
216,不意外的又是法官判斷加害者當時喝酒非行為能力
216,吵鬧過程法官只是冷淡講了幾句後離開
216,原本小女孩爸爸打算萬輕判，就要自己動手解決這件事
216,後來的劇情就讓你們自己去看了
216,小肥我昨天看完這部電影可以說是從頭眼淚飆到尾部分原因因為小女孩跟我姪女有點像
216,又難過又生氣氣是氣在加害者只要說自己喝酒意識不清
216,我們的司法就會保護加害人台灣跟韓國都樣
216,而小女孩的爸爸萬真的動手被抓去關這個家庭也就完了
216,這個案例在台灣也有類似的事件
216,大約在年前位五歲女童被謝嫌以竹竿插入下體腸子都被抽出來
216,往後人生只能以人工肛門排便
216,最後最後施暴者卻無罪釋放
216,會發這篇文是因為在留言看到有位版友提到私刑正義
216,每次看到社會新聞又有什麼大事件
216,小肥我就會心想萬事情發生在自己身上或自己身邊的人身上
216,我有沒有勇氣自己去解決這件事嗎
216,可能要等到萬發生了才知道
216,那如果自己身邊的人發生自己都在猶豫了
216,那又怎麼可能為了其他陌生人執行私刑正義
216,台灣每次發生重大事件輿論熱度絕對不超過兩個禮拜
216,有其他嚴重事件也會輕易被帶風向事情就淡掉了
216,也不記得這件事需要被改變
216,還記得清國中割喉案嗎
216,還有多少人提起呢
216,事件過後改變了什麼
216,我就住在那學校附近開始還會看到警察站在校門口
216,但也就那幾天而已風頭過後就再也沒看見過了
216,台灣就是這樣健忘的台灣人
216,推薦給大家去看這部片很好看
217,最近討論熱烈的電影周處除三害
217,裡面講到台灣過去的刑事事件，劇情和演員表現都不錯
217,突然想到，那台灣有哪三害
218,阮經天在年，金馬獎還沒變成湾湾自爽獎項前
218,就以歲之齡拿下
218,經過多年的歷練，演技變得更加成熟
218,這次周處除三害的精采表現
218,放眼台湾中生代男演員，無人能出其右
218,阮經天，第二座金馬影帝穩了吧
219,大家豪桂林仔豪
219,挖靠桂林仔有槍阿
219,挖靠小弟只會在旁邊看戲阿
219,挖靠桂林仔吃豐米便當吃好快阿
219,如果這部給豆導拍
219,會拍出怎樣的水準在中國也會很受歡迎嗎
219,有卦咪
220,明道和阮經天以前都被說長得很像
220,最近周處除三害在中國爆紅
220,也有中國網友去誇明道演周處演得好
220,///
220,明道也是中劇常客，戲約不斷
220,在最近的爆火劇烈焰演亘古
220,///
220,在即將上檔的金庸武俠世界演洪七公
220,///
220,明道和阮經天在中國誰比較紅
221,是這樣的拉
221,國片就是爛這就是結論
221,但這次周處除三害在大陸很成功
221,但是我怎麼看都不像國片
221,果然製作單位是兩地合作
221,所以表示台片沒有中國人的扶持
221,就不能自立了嗎
221,是這樣嗎
221,大家覺得呢
221,可以看到這部電影中國人幫了很多忙
221,因為根本就不打算賣台灣市場阿中國人出的力中國人說的蒜
221,我看你是很不董中國中影在裡面有多大幫助
222,各位水水安安
222,各位帥帥安安
222,各位肥宅安安
222,大家好唷
222,小妹想要問問大家個問題
222,問問看唷
222,最近堆電影解說
222,說這部電影多棒多厲害
222,確實還可以
222,但是也沒有那麼精彩絕倫吧
222,周處除三害是不是被吹捧太多了
222,有木有更多相關的八卦呢
222,嘻嘻
223,看了下最近很紅的周處除三害故事
223,原來是第三名通緝犯因為癌末跑去幹掉第名跟第二名的故事
223,導演雖然說是香港人在台灣拍的
223,但感覺跟我熟知的台灣的周處跟三害不同
223,感覺讓熟知社會議題的鄉民來拍會更好
223,如果讓鄉民來拍會怎樣演
224,看完周處除三害了，
224,覺得劇情有點太直白了，
224,很多感情戲都處理的莫名奇妙，
224,如果給國際名導李安來拍周處除三害，
224,會怎麼拍呢
224,有沒有八卦
225,世界頂級的大導演麥克貝
225,曾拍攝過許多好萊塢動作大戲
225,如果今天換他來執導周處除三害的話
225,會是怎樣的演出呢
225,最後的靈修舍直接用炸的
226,安安八卦板的各位
226,周處除三害最近很紅
226,如果給台灣導演第二把交椅魏德聖執導
226,會不會拍出不同風味
226,甚至更上層樓把格局拉到史詩大片等級
226,有卦
227,周處除三害中國爆紅通過審查外界熱議
227,///////
227,周處除三害海報
227,種態度電影股份有限公司提供
227,大紀元年月日訊大紀元記者馬維芬報導台灣電影周處除三害在中國
227,爆紅，周票房就賣破億人民幣約億元台幣，度登上微博熱搜，至於該片為何能
227,通過中共嚴格審查，也引發外界熱議
227,其中，已故作家李敖之子李戡發文諷刺，該片能在
227,中國上映，證明中共宣傳部門很白癡
227,李戡日前在臉書點這裡發文提到，按照中共神經兮兮被害妄想症的審查標準，黑
227,社會動私刑邪教已經觸碰禁忌，除害容易讓人有不當聯想，至於邪教教主割信
227,徒韭菜這段，根本是赤裸裸的諷刺現實
227,周處除三害能在對岸上映，再度證明中共
227,宣傳部門有多白癡
227,///////
227,周處除三害最佳動作設計獎
227,種態度電影股份有限公司提供
227,台灣作家苦苓則在臉書點這裡發文表示，如果習近平也不小心看了周處除三害
227,，定會發現片中的邪教就是在諷刺他和共產黨而且預言了他們的集體滅亡是誰
227,放行這部電影的
227,恐怕有很多人要挫咧等
227,另外，日本產經新聞台北支局長矢板明夫則在臉書點這裡提出分析，此片在中國
227,上映，不到週票房賣出將近億元人民幣約億台幣，更力壓趙麗穎的第二十
227,條以及賈玲的熱辣滾燙等片
227,有趣的是，這部電影在台灣的票房並不突出，大約
227,只有千萬台幣
227,他深入瞭解後，提到這部電影的故事十分單純，描寫的是個自認為來日無多的殺人犯，
227,發現自己在台灣通緝要犯排行榜上竟然屈居第三，於是決定要除掉在他前面的兩個人
227,這是部崇尚暴力美學的電影
227,導演是來自香港的黃精甫
227,敘事方式有點像日本的北野
227,武所拍攝的黑道電影，登場人物言不合就開槍，殺人者和被殺者之間並沒有深刻的矛盾
227,而且，殺人者不僅要殺自己想殺的人，連周圍的嘍囉和隨從也要併幹掉
227,說句老實話，我個人認為，這個電影的故事和節奏，和今天的台灣社會並不太符合
227,或
227,許能夠吸引些年輕男性觀眾，但其他族群應該不會太喜歡
227,讓人感到奇怪的是，這麼
227,部可能存在爭議的電影，為什麼能通過中國當局嚴格的審查在中國國內的電影院上映呢
227,///////
227,日本產經新聞台北支局長矢板明夫資料照
227,新唐人電視台
227,他認為有兩個可能原因第，是電影中的中國要素，片名來自世說新語中周處
227,除三害的典故，主人公名字叫陳桂林，讓人覺得非常中國感覺台灣並沒有去中
227,國化，這點中國當局很喜歡
227,第二影片描寫了很多台灣社會的陰暗面，有黑道槍
227,戰黑醫還有邪教和愚昧的民眾
227,如果不了解台灣的真實狀況，只看電影的話，會以為
227,台灣是這樣個弱肉強食民不聊生的地方
227,至於這部片，為何在中國叫座
227,矢板明夫認為這和中國這幾年經濟不好當局對言論管控
227,越來越嚴格很多人生活越來越壓抑有關
227,看到電影裡，小人物用暴力反抗社會大開
227,殺戒的故事，會達到舒壓的效果
227,在中國的網路上，對周處除三害最多的評價是這
227,是部爽片
227,責任編輯劉宇涵
227,///////
228,桂林仔給分鐘時間逃跑
228,有的人第秒就跑
228,也有的人拖到最後十秒才跑
228,拖到最後十秒才跑的人
228,心裡在想什麼
228,是先打卡拍照上傳到批踢踢發廢文才跑嗎
228,還是嚇倒跑不動
229,如蹄
229,周處除三害，在大陸賣的不錯
229,近年來很少國片有這樣的成績了
229,但國內好像沒什麼共鳴
229,如果是得到威尼斯影展大獎
229,是不是會狂跑字幕台灣之光國片軟實力最佳寫實紀錄片等等
229,甘油卦
230,周處除三害
230,最重要的段劇情是
230,王淨露側奶
230,除此之外
230,第二重要的是
230,他殺的不只是前兩名的要犯
230,而是在把第名殺掉之後
230,還有些人繼續唱歌
230,所以他回頭把這些神經病
230,通通幹掉了
230,不然這些唱歌的
230,肯定會複製出下個教主
230,這就是
230,除惡務盡
230,個都不要留下
231,周處除三害最近非常的紅，
231,但是好像少了點幽默搞笑的元素，
231,如果周處除三害給朱延平導演拍的話會怎麼拍呢
231,有沒有八卦
232,內容有雷拉，不想被雷趕快先出去
232,開始桂林仔去槍殺鐵頭哥
232,結果旁邊小弟每個都讓出走道給桂林跑
232,大哥身邊沒半個人保護
232,沒任何成員敢出來報仇
232,東興至少還敢跳出來火拼好嗎
232,桂林仔身為通緝要犯第三名，能窩藏四年
232,代表有定程度的預警，識別，躲藏技巧
232,結果大辣辣的毫不掩飾自己，做事後知後覺
232,香港仔更是完全不動聲色就能察覺被監視
232,雖然說面對死亡，人難免會恐懼
232,但桂林這種在槍口刀口上討生活的人
232,早就有出去就回不來視死如歸的覺悟
232,結果因為肺癌末期被林錄和那麼智障的手法欺騙
232,這真的是面對大風大浪的人
232,更別說林錄和跟通緝照片根本樣
232,愚蠢到相信真的死了，去入教
232,演技就更不用說了
232,阿季真的是戲精，出場那種有氣無力的說話語調就看得出真正得癌的是自己
232,阮經天從艋舺至今還是那副樣子，鳳小岳演華燈都比過去優秀多了
232,陳以文發揮得很好，完全演出那副讓人討厭到恨不得殺爆的樣子
232,整部片爽片到不行
232,帶頭腦看真的會氣死
233,這部片我本來也都不知道
233,直到最近很多人在提
233,就在網上開來看
233,看半個小時後我就按暫停
233,因為這部片的調性跟我認知的國片很不樣
233,看到導演是香港人才明白為什麼有這種違和感
233,坦白講
233,這部片很不賴欸
233,節奏很好，運鏡不錯很多畫面拍攝角度也好看
233,演員的台詞少，都用畫面跟氛圍在推動故事
233,講了七分故事，留下三分意象讓你去思考
233,前面對香港仔就是動作暴力
233,後面邪教部分又變的妖異
233,我印象中的國片就是角色會有大段悲傷的過去
233,然後陳桂林會跟女主角在海邊講起大堆過往，他如何跟奶奶相依為命，如何被欺負然後為
233,了自己不再被欺負而加入黑幫的
233,陳桂林去警局自首的時候，會出現緊張的音樂，然後幾個故弄玄虛的畫面，接著定格五秒才
233,出現陳先生喔，要自首要排隊喔
233,不知道是我對國片的印象太差還是怎樣
233,真是覺得這部片真的挺好看的
233,而且又各種影射的擦邊球
233,不然香港導演這種政治敏感度高的
233,通常都會極力避免這種形象巧合重疊
233,只能說電影這部分
233,香港對比台灣
233,就是瘦死的駱駝比馬大
234,看前面她也不像是被洗腦的啊
234,就個合夥騙人的人
234,怎麼老大沒了
234,她跟其他迷信的人樣不動
234,老實說她第時間跑
234,其他人也會跟著跑吧
234,這樣能少死堆耶
235,欸欸
235,小妹妹
235,在看最近很紅的
235,周處除三害
235,看半個小時
235,堆打打殺殺
235,言不合就扁揍
235,到底為什麼
235,這部片
235,那麼多人推啊
235,卦
236,如題
236,想請問下
236,如果讓豆導來導周處除三害的話
236,會出現甚麼樣的場景
236,有甚麼樣的對白
237,周處除三害
237,香港仔真的演得很不錯
237,壞人的樣子都演出來
237,王淨演的也不錯
237,只是大家覺得那個角色還有哪個台灣女藝人演得更好
238,啦
238,周處除三害裡面
238,陳桂林吃便當吃得津津有味
238,讓中國人看了也都想吃
238,如果當初劇組買的是台菜二世祖的手路菜便當
238,陳桂林吃完會怎樣
239,今天看了周處除三害還蠻好看的
239,裡面讓我最入戲的就是邪教那段
239,宗教的洗腦真的會讓人改變道德跟價值觀
239,以前有個媽媽眼睜睜看著自己兒子在眼前被打死
239,還認為是在救兒子想到就毛骨悚然
239,不過現實中接觸過這種邪教的人多嗎
239,就是不拜大眾普遍認知的佛道教神明
239,而是某個大師自稱為佛或尊者聖人
239,變成這個教派的信仰中心
239,這種就是標準的邪教了吧
239,有人參加過這種邪教的活動嗎
240,原來香港仔就是直逼問星爺加底不加底的那位
240,這根本可以跟喜劇之王串起來當香港仔前傳了
240,///
240,香港老牌演員真的功力是台灣演員完全沒法比擬的
240,周處裡面最精彩的戲都是香港仔的部分
240,真的是眉宇之間那種令人不含而立的恐怖
240,而且他還演過很多是真的慈眉善目的角色
240,又是完全不同感覺
240,真的很厲害
241,如標題
241,想請問各位大大
241,周處除三害片中的新心靈舍是在哪拍的
241,雖然劇中是說在澎湖
241,但因為網路上都找不到實際拍攝的地點
241,麻煩幫忙解惑
241,謝謝
242,有說蜂刑者跟周處除三害哪個好看
242,同樣都是殺殺殺的爽片
242,因為啦
